<?xml version="1.0" encoding="UTF-8"?>
<tns:Employee xmlns:tns="http://www.deepakbhalla.com/Employee"
	xmlns:xsi="http://www.w3.org/2001/XMLSchema-instance"
	xsi:schemaLocation="http://www.deepakbhalla.com/Employee Employee.xsd"
	sampleAttribute="samlpeValue">

	<!-- Please note: This file has been generated by using Eclipse IDE by referring 
		to the Employee.xsd file -->

	<tns:id>12345</tns:id>
	<tns:name>tns:name</tns:name>
	<tns:age>tns:age</tns:age>
	<tns:email>tns:email</tns:email>
	<tns:dob>tns:dob</tns:dob>
	<tns:gender>M</tns:gender>
	<tns:phone>56789</tns:phone>
	<tns:phone>56123</tns:phone>
	<tns:paymentType>
		<tns:insurance>
			<tns:limit>12345</tns:limit>
			<tns:provider>ABCD</tns:provider>
		</tns:insurance>
	</tns:paymentType>

</tns:Employee>